{
  "schema_version": "1",
  "project_name": "phonemall",
  "created_at": "2026-07-16T10:00:01Z",
  "dataset": {
    "version": "phase0-example",
    "hash": "sha256:bbbbbbbbbbbbbbbbbbbbbbbbbbbbbbbbbbbbbbbbbbbbbbbbbbbbbbbbbbbbbbbb"
  },
  "run_fingerprint": {
    "target_revision": "2f0ecb46cffc2f16e1d63ae26be49d6c89f94320",
    "adapter_version": "phase0",
    "eval42_version": "phase0",
    "config_hash": "sha256:aaaaaaaaaaaaaaaaaaaaaaaaaaaaaaaaaaaaaaaaaaaaaaaaaaaaaaaaaaaaaaaa",
    "metric_hash": "sha256:cccccccccccccccccccccccccccccccccccccccccccccccccccccccccccccccc",
    "environment": "fixture"
  },
  "summary": {
    "recall_at_5": 1.0
  },
  "cases": [
    {
      "case_id": "phone-camera-001",
      "case_hash": "sha256:dddddddddddddddddddddddddddddddddddddddddddddddddddddddddddddddd",
      "status": "completed",
      "metrics": {
        "recall_at_5": 1.0
      }
    }
  ]
}
